{
  "$schema": "http://json-schema.org/draft-07/schema#",
  "$id": "https://schemas.cudl.lib.cam.ac.uk/package/v1/collection.json",

  "definitions": {
  },

  "type": "object",
  "properties": {
    "@type": {"const":  "https://schemas.cudl.lib.cam.ac.uk/package/v1/collection.json"},

    "name": {
      "allOf": [
        {
          "type": "object",
          "properties": {
            "url-slug": {"type": "string"},
            "sort": {"type": "string"},
            "short": {"type": "string"},
            "full": {"type": "string"}
          },
          "additionalProperties": false
        },
        {
          "$comment": "short or full (or both) must always be present",
          "anyOf": [
            {"type":  "object", "required": ["short"]},
            {"type":  "object", "required": ["full"]}
          ]
        }
      ]
    },

    "description": {
      "allOf": [
        {
          "type": "object",
          "properties": {
            "short": {"type": "string"},
            "medium": {"type": "string"},
            "full": {"$ref": "common.json#/definitions/htmlReference"}
          },
          "additionalProperties": false,
          "minProperties": 0
        }
      ]
    },

    "credit": {
      "type": "object",
      "properties": {
        "parties": {
          "type": "array",
          "items": {
            "oneOf": [
              {"$ref": "common.json#/definitions/moduleReference"},
              {
                "$comment": "Use properties from https://schema.org/ Organisation or Person",
                "type": "object",
                "properties": {
                  "@type": {"enum":  ["Organisation", "Person"]},
                  "name": {"type":  "string"},
                  "url": {"type":  "string", "format": "uri"}
                },
                "required": ["@type", "name"]
              }
            ]
          }
        },
        "prose": {"$ref": "common.json#/definitions/htmlReference"}
      },
      "required": []
    },

    "items": {
      "type": "array",
      "items": {
        "oneOf": [
          {"$ref": "common.json#/definitions/moduleReference"},
          {
            "type": "object",
            "properties": {
              "item": {"$ref": "common.json#/definitions/moduleReference"},
              "visible": {"type": "boolean"}
            },
            "required": ["item"]
          }
        ]
      }
    },

    "collections": {
      "type": "array",
      "items": {"$ref": "common.json#/definitions/moduleReference"}
    }

  },
  "required": ["@type", "name"],
  "additionalProperties": false
}
